ID,answer
67,"Binomial distribution is a probability distribution of an experiment with only two outcomes. When there are only two outcomes of interest, such as clicking or not clicking on an ad, the assumption that each outcome is independent, and there are enough experiments to use the Binomial distribution to estimate the probability of the outcome. The reason why using the Binomial distribution is a good choice may lie in the suitability of the statistical model to the experiment and the available data. However, it should be noted that there are limitations, such as the assumption that each outcome is independent, which is not true in some cases, and the potential for more complex calculations or analyses. The decision to use the Binomial distribution should be based on the nature of the data, the experiments available, and the suitability of the statistical model used. Theory and practice should be considered to make decisions about data analysis as reasonable and accurate as possible."
68,"Agreed, because A/B Testing is good for comparing the results (in this case, the number of times users click on an ad) of two actions, in this case, moving the ad position and not moving the ad position."
69,"I disagree because clicks are not independent of each event, as users who have clicked on an ad may behave differently than before they clicked."
70,"A/B testing should be used to test the placement of ads in Hamtube. A/B testing allows Hamtaro to see the impact of the placement of ads, adjust the variables being tested, and also allows Hamtaro to choose the best option.
"
71,"Using the binomial distribution in Hamtaro&#39;s A/B testing can be an appropriate choice because 1. It is a Bernouli&#39;s addition, and 2. The binomial distribution is suitable for data that has only two outcomes, such as &quot;click&quot; or &quot;no click&quot; on an ad. If Hamtaro&#39;s A/B testing experiment focuses on measuring the number of ad clicks, then using the binomial distribution is appropriate."
72,"Choosing the proportion of users exposed to the old and new placements has implications for A/B testing. The advantage of a 50/50 ratio is that it offers a win-win test with no transition lag, while an 80/20 ratio can help create new comparisons between variables and experiments without requiring a large number of users to be exposed to the new ad immediately. The disadvantage of an 80/20 ratio is that experiments can take longer to gather significant data for analysis and precision. The choice of the right ratio will depend on the needs of the experiment and the goals of the experiment, so a 50/50 ratio would be more appropriate for this problem, as it offers a win-win test with no transition lag."
73,"Hamtaro should use A/B testing because it allows Hamtaro to gather data on how users interact with different ad placements, allowing him to make informed decisions based on real user behavior. It also provides tangible evidence of the impact of ad placement changes on user interactions."
74,"Advantages of 50/50 - It provides balanced, equal data from both groups and allows for a fair comparison, reducing the risk of randomization error. Advantages of 80/20 - If there is concern about possible effects of the experiment, using a proportion that is biased towards the old position (80%) will reduce the risk. It is considered better to use 80/20 since it is the option that affects fewer users who click and therefore is the less risky approach."
75,"Hamtaro should consider using the binomial distribution for A/B testing. Here are the reasons. 1. Binary Outcome: The binomial distribution is well-suited for scenarios where there are only two possible outcomes for each trial, in this case, whether a user clicks on an ad or not. This aligns with the nature of click-through rate (CTR) measurements in A/B testing. 2. Independent Trials: The trials in A/B testing are typically independent, meaning that the outcome of one user&#39;s interaction with the platform does not affect the outcome of another user&#39;s interaction. The binomial distribution assumes independence between trials. 3. Fixed Number of Trials: A/B testing involves a fixed number of trials (users exposed to version A or B), and the binomial distribution is appropriate for situations where the number of trials is predetermined. 4. Simple and Well-Understood: The binomial distribution is a simple and well-understood probability distribution, making it easy to calculate probabilities and conduct statistical tests. This simplicity is advantageous for practical implementation in A/B testing scenarios."
76,"Ranularity should be at an appropriate level that allows results to be examined in a period that is not too short or too long. It should not be selected at a level that is too small to be able to compare changes, or it should be selected at a level that is too large to be difficult to analyze. Attribution period should be selected at an appropriate period of time according to the nature of the business and the usage pattern that Hamtaro uses in order to obtain data that reflects the reality of the results well enough."
77,"I agree because pressing has 2 events: pressing or not pressing, which is in line with the binary principle of doing or not doing."
78,"It should be Hits/Impressions and the attribution period should be one-min attribution because Hamtaro wants to know if the ad is clicked, which is something that if seen, people can immediately decide whether to click or ignore it. Therefore, having the granularity as Hits/Impressions is appropriate for the ad to be seen because people who see it and like it should click from the first time. There are not many people who see it and then go back to click."
79,"I agree with the use of A/B testing for testing the placement of ads on Hamtube, because there are important reasons for making marketing decisions: 1. User behavior: Different users in different situations may have different behaviors towards ads. For example, users in the part where the ad is shown may have different interests. A/B testing helps to understand the behavior of users in different situations and their responses to ads in detail. 2. Spatial marketing planning: A/B testing that places ads in different locations on the platform gives a comprehensive picture of the areas that affect ad response. 3. User customization: A/B testing helps to understand the preferences of users and how each group has different interests, so that marketing can be tailored to the target group effectively. A/B testing is a good way to thoroughly examine and adjust marketing for different users and environments. This way of checking will give Hemtaro the information he needs to make decisions to adjust his marketing plan with more confidence."
80,It is easy to define relevant metrics and clearly divide them into two assumptions.
81,"The granularity should be the number of times the video is viewed so that it can be compared to ad clicks, and the attribution period should be around 1 day."
82,It is the number of times ads are shown. The length of the attribution period is 1 day to check if users click on ads within 1 day.
83,I agree with using A/B testing in testing because it is a problem that can be easily divided into control and experimental groups by simply changing the UI of the user who accesses the website. 
84,"User Level: Setting granularity at the user level can provide very detailed information about individual behavior, making it easier to tailor marketing strategies to the needs of the target audience. Channel Level: Gathering data at the channel level can help you understand the performance of individual marketing channels, allowing you to tailor marketing strategies to each channel. Campaign Level: Setting granularity at the campaign level can provide an overview of the performance of different campaigns and help you analyze the results of all marketing activities. The attribution period should be based on the nature of your business and your customers’ behavioral patterns. If your business has customers who need a long time to make a decision, the attribution period should be long enough to cover this process. If your customers have a fast-moving behavior pattern, a shorter attribution period may be sufficient to analyze and adjust your marketing strategy. This period should be set in line with your marketing and business objectives."
85,"It should be used in a session format, with the length of the attribution period being around 15 minutes - 30 minutes, compared to the clicks in that session, for example, if clicked in that session, count as 1, if not, count as 0. The design is this way because most of the things that are placed in ads like this are probably not very expensive and the user can make a decision in a short period of time. If given more time, it is possible that the user clicking in may not be because of the ads, but may be due to other variables, such as buying according to friends, etc."
86,"Use A/B testing because it is a test with a group that saw the ad in the original position and saw the ad in the new position, which is divided into two groups and can conclude which one creates better sales."
87,"Click on all ads, all views to see how many people have viewed it in a day."
88,"50/50 Advantages: Easy and clear division, doesn&#39;t take long to collect sample size, testing can be done quickly. Disadvantages: High risk, may cause a lot of loss if the new advertising format makes less profit. 80/20: Advantages: Lower risk, not much loss if the new advertising format makes less profit. Disadvantages: Small sample size, needs much longer collection time. Assuming that hamtube is a fairly large company with many users, it must make the risk of loss low, so it&#39;s better to use 80/20."
89,"The granularity should be #click/#cookie-days, each cookie is a Bernoulli trial, and the attribution period should be 1 day because most people spend less than 1 day watching a video."
90,"A/B testing should be used because A/B testing is designed to test the old (A) and new (B) versions of an ad, in this case whether the new ad placement has an effect."
91,"It should be done because A/B Testing will result in 1. Data-Driven Decisions, not &quot;guessing&quot; and 2. Risk Mitigation. Changing the placement of all ads may cause the business results to drop. A/B testing will allow you to try with some customer groups to see if it works or not. In addition, you will get User Behaviour that Users tend to press which buttons or where to put things, whether they can be found or not. It can be used for other things besides Ads."
92,"A/B testing is a test of only two hypotheses (new ad position does not increase sales vs. new ad position increases sales), which is appropriate for this problem."
93,"Agreed, because this experiment has only one possible outcome: click or no click, which fits a binomial distribution, with only one possible outcome: success or failure."
94,"I agree because 1. It is a test of 2 different groups and we want to test which test gives better results. 2. In the experiment, there may be other things that affect our experiment, which is something called Randomness, because the experiment must involve many other factors that we cannot control. Therefore, using A/B test is appropriate by keeping all factors constant. The outcome will depend only on the position of the ad and Randomness. "
95,A/B testing is an ideal tool for testing ad placement changes to measure their impact on user clicks on your ads. This experiment allows Hamtaro to compare results between a group of users who saw the ad in the old position (the control group) and a group who saw the ad in the new position (the experiment group). The advantage of this method is the ability to assess the impact of a specific change while minimizing the impact of external factors.
96,"50/50 Ratio Advantages: An experiment is an experiment in which all items have an equal chance of being shown the new or old placement. This allows for comparable data in both situations. Disadvantages: The results are not immediate if there is a difference in results because there may be users with different behaviors. 80/20 Ratio Advantages: The experiment can provide immediate results and the results are available from a larger number of users who are exposed to the new placement, reducing uncertainty in decision-making. Disadvantages: The experiment may have skewed results if the results are shown to users who are more popular or have a higher chance of switching. The choice of ratio depends on the purpose of the experiment. If Hamtaro wants data from all user groups, a 50/50 ratio might be appropriate. However, if immediate results are needed and resources are limited, an 80/20 ratio might be a good choice because it allows for more efficient and effective data collection from a more likely group."
97,"I agree that Hamtaro uses A/B testing because what Hamtaro wants to know is whether moving the ad position will increase sales (more users click on the ad), and A/B testing is just two different versions of testing."
98,"Using a 50/50 split can collect more data, which allows for a shorter experiment, but there is a greater risk of a drop in sales since most users do not like this split. An 80/20 split can collect less data, which allows for a longer experiment, but there is a lower risk of a drop in sales since it is tested with fewer users. In this case, the 80/20 split should be used because it is possible that changing the ad position will cause a large drop in sales, and it is also important to see whether the increase in sales is due to the new group or the same group, since it is possible that the new group is just a fad, which may not actually increase sales."
99,"A/B Testing is recommended because it involves testing two audiences, seeing different ad placements, and determining which placement is more effective."
100,"Granularity A/B testing should be done at the individual user level to allow detailed analysis of the data and understanding of the target audience&#39;s behavior. The attribution period should be long enough to capture the true impact of changes in ad placement without eliminating potentially relevant data, such as 30 days."
101,A/B testing should be used because it is a comparison of two versions of an app page with different ad placements to find out which ads users click on more by collecting data and doing A/B testing and then concluding the results.
102,Reasons why Hamtaro should use A/B testing: 1. Save time and resources: A/B testing requires less cost and resources because it does not require testing on every user. 2. Reliable data: A/B testing helps to provide reliable data by comparing the changed group with the unchanged group.
103,"Granularity: user id because it is unique and some users may come to view repeatedly, which may cause the count to be over. Attribution period: 1 day because users are likely to come to view once a day and seeing the ad is a short time before deciding to click, so the attribution period should not be set to be too long."
104,"A 50/50 ratio will provide balanced data and a fair comparison between the two groups, but it may take longer to accumulate statistically significant data. An 80/20 ratio is useful where the impact on user experience is most likely to be minimized, but it may expose the data to greater risk of statistical error due to the smaller sample size. Choosing the right ratio depends on how flexible Hamtaro is to accept risks and the goals of the experiment."
105,"Using a binomial distribution is suitable to replace the distribution of A/B testing because it measures the probability of an ad click / no click. If measuring only one user, it will be a bernoulli distribution. But when counting all users in Hamtube, the total bernoulli will be a binomial distribution where all users are independent. "
106,"Assumption: People click on ads = get money Granularity: Use only hits because it doesn&#39;t matter who clicks, only cares about how many clicks Attribution period: 1 day because it&#39;s so easy to click ads"
107,"A/B testing is the right way for Hamtaro to test the placement of his ads on Hamtube for the following main reasons: 1. Evidence-based decision-making: A/B testing allows Hamtaro to make informed decisions. Comparing the results between the group that saw the ad in the original position (Group A) and the group that saw the ad in the new position (Group B) allows him to see how the change affects the clicks on his ads. 2. Controlling for noise: A/B testing provides the ability to control for noise and other variables that may affect the results. By randomly allocating users to each group, Hamtaro can be sure that the results are solely the result of the change in ad placement. 3. Accurate measurement: A/B testing allows Hamtaro to clearly and precisely measure the impact of the change. He can check whether the clicks on his ads increase and to what extent. 4. Risk reduction: Testing on a small scale before making a large-scale change reduces the risk of making a decision that may negatively affect the user experience or profitability. 5. Ability to continuously improve: The results from A/B testing can be used to continuously develop and improve the platform. If the change does not work, Hamtaro can experiment with new approaches."
108,- Can directly measure the effect of ad repositioning - Can tell whether ad repositioning has an effect on sales
109,I agree with using bernoulli because we have 2 possible scenarios: press and don&#39;t press the ad.
110,"A/B testing can be used in testing because we have metrics to measure the results, and this test is a test between the original (old ad position) and the new (new ad position)."
111,"This is appropriate because the Binomial distribution is suitable for experiments with only two outcomes (success or failure), and this A/B testing experiment has two outcomes: click on the ad or no click on the ad, which fits the characteristics of the Binomial distribution."
112,"A/B testing allows Hamtaro to test changes in ad placements against a control group that does not make changes, allowing him to determine whether moving ad placements would have an impact on sales and providing him with statistically sound data to make informed decisions about how to adjust his marketing plans."
113,"The advantage of using a 50/50 ratio is that it can work faster, but in exchange for the disadvantage that the risk of users not liking the move to a new ad is higher. The advantage of using an 80/20 ratio is that the risk of users not liking it is lower, but in exchange for it taking longer to collect data. Personally, I think using a 50/50 is better because moving the ad doesn&#39;t have much effect on users, and for increasing sales, the faster the data can be collected, the better."
114,"Agreed, because the outcome Hamtaro is interested in is &quot;Did the user click on the ad?&quot;, which is a binary value."
115,"50/50 Advantages: The sample size of both groups is equal, making the comparison easier, clearer, and more reliable. Disadvantages: If this change has a negative impact, a lot of business opportunities will be lost during the experiment, because 50% of customers use the bad model during the experiment. 80/20 Advantages: Reduces the risk that the new ad position may have a negative impact on users, because only 20% of customers use it. Disadvantages: Less data will be obtained, making the statistical reliability less. This problem should be solved with 50/50 because it will get more statistically reliable data. The loss of business opportunities if the new results are not good is not important, because the attribution period of this experiment is only 7 days, making the impact very small compared to the data and opportunities that we will get."
116,"50/50 Pros: It is much faster to complete the experiment with the n people you set. Cons: If there is a problem with the newly created ad position experiment, the damage will be huge. 80/20 Pros: If there is a problem with the newly created ad position experiment, the damage will be much less than 50/50. Cons: It is still risky and the data is collected slowly. Choosing the most appropriate method depends on how big Hamtube is. If it is a small startup, 50/50 should be used to quickly increase sales. If it is a large company, 80/20 should be used, which should actually be less since it is just moving ads. You should accept the lowest risk and gradually collect a/b testing data to avoid huge losses."
117,"Granularity: # ads clicked/#total views shows how many people clicked on the ads. Attribute period: 1 day Because Hamtube is a website that people visit frequently, it should not have a period of time that is too long."
118,"50/50 model Advantages: Equal experimentation, not focusing too much on any one position. Disadvantages: Can&#39;t see the impact of having a new position. 80/20 model Advantages: Can gradually test user behavior in changing positions, low risk. Disadvantages: Unequal proportion, low chance of seeing ads in the new position. I think 80/20 model is better, in order to see user behavior, find consistency between the old and new positions while doing testing, which will be useful for future testing."
119,"50/50: It takes less time to collect data, but there is more risk from placing ads in new positions. 80/20: It takes more time to collect data, but there is less risk from placing ads in new positions. Answer: 50/50 because the risk from placing ads in new positions is not significant. Hamtube users use the platform primarily to watch online videos, not to watch ads. Placing ads is unlikely to have much of an impact on users&#39; experience, so they can accept a greater risk from placing ads."
120,"Agree because - It is data driven insight, meaning there is real data to support the decision, not just feelings. - A/B testing is comparing two (or more) versions of a variable, with the same control variables, which is the case in this situation. However, the samples of both versions must be the same and must represent the population."
121,It should be used because using A/B testing can reduce risk and measure business results when comparing results A to B.
122,- Granularity should be session level to see if ad position shifting causes clicks in each session. - Attributution period should be 1-3 months to see if ad position shifting causes clicks in the long run.
123,"It is appropriate because there are other factors that affect sales, such as the advertising clip at that time, the popularity of society at that time, the social trends at that time, the country&#39;s finances at that time, which makes it acceptable to use A/B testing. "
124,"1. Data-Driven Decision Making: A/B testing provides concrete data on user behavior and preferences. It allows Hamtaro to make decisions based on evidence rather than assumptions. 2. Identifying Causation: A/B testing helps establish a causal relationship between changes made (moving the ads) and the observed outcomes (click-through rates, revenue). This is crucial for understanding the true impact of the change. 3. Optimizing User Experience: By testing different ad positions, Hamtaro can identify the placement that enhances the user experience and encourages higher engagement. This is important for long-term user satisfaction. 4. Maximizing Revenue: Ultimately, the goal is to increase revenue. A/B testing allows Hamtaro to fine-tune the platform for maximum profitability by identifying the most effective ad placement."
125,"Granularity should be the number of ad clicks a user gets in each session to measure whether ad placement influences click-off. Attribution period should be 1-4 weeks, as this is not too little time to collect data from users and not too much time to be disturbed by external factors."
126,Should use bernoulli more than just click to view or not click to view
127,A/B test is suitable because it can clearly analyze the impact of this change on sales. It reduces the risk of impact on sales. It is reliable because the variables are well controlled and the results are accurately measured.
128,"Agree, because if we want to measure whether users click on ads more or not, we should count the number of clicks, which each person will have only one case of click (success) and no click (failure), which is a bernoulli distribution. So when this event occurs in many people who are independent, it will be a binomial distribution."
129,"Agree because each person&#39;s probability is Bernoulli and when combined, it becomes a Binomial Distribution."
130,Agree because - It is suitable for experiments with only two outcomes (click or no click) - It is easy to calculate and has a clear formula for calculating the probability of the outcome - It is suitable for experiments with equal proportions and independent experiments - It is flexible to apply to experiments with different sample sizes.
131,"The 50/50 method takes a shorter trial period but has a higher chance of affecting your overall income. The 80/20 method takes a longer period but has a lower chance of affecting your overall income. I chose the 50/50 method because the trial period mentioned above is 2 weeks, which is not that long and the results are fast."
132,"Choosing a 50/50 split means equally distributing users between the two test groups, which should give a balanced view of user interactions with the ads. An 80/20 split would mean one group is larger than the other, which could introduce bias into the test results. For Hamtube, a 50/50 split is typically more reliable for understanding the true impact of ad placement changes."
