ID,answer
270,"50/50 Advantages: Get complete information quickly because both groups will take the same amount of time to collect samples. Disadvantages: 1. There is a risk to the business because if the Experimental creates a negative impact, it will greatly damage the business. 2. It is easy for independence to occur because when there are a large number of users seeing changes, the 2 user groups will talk to each other. 80/20 Advantages: Low risk Disadvantages: Collecting samples from small groups is slow. Choose 80/20 because the advertising system has a great impact on the business&#39;s income, so it should not be too risky."
271,Granularity is the number of userIds that clicked on the ad / the total number of userIds that saw the ad. The attribution period should be 1 day because the ads may be different every day.
272,"Pros/Cons 50/50 Pros: It takes less time to collect samples of 2 groups that see ads in different positions equally. Cons: The risk to sales is high because we don&#39;t know if the new model will have any problems that affect sales, such as causing sales to drop because people don&#39;t notice the new model. 80/20: Pros: It is less risky than the 50:50 model because the new model has only a 20 percent chance of being seen. Cons: It takes a long time to collect the same number of samples of users who see ads in both the new and old models. I think 80/20 is more suitable because even though it takes a long time to collect, the risk of problems that affect the original sales is reduced."
273,"Granularity - Medium to high Segmenting the data by different user groups or videos can help marketing teams gain a clearer picture of the results of an A/B test. Since Hamtube is a platform with a large number of users, an effective granularity would likely be medium to high. Attribution Period - 2 to 4 weeks, so that the impact can be detected immediately and over a medium to long period of time."
274,"
Using a binomial distribution in A/B testing is only appropriate when there is a binary outcome, such as clicks or no clicks, and a known number of trials. Using a binomial distribution makes the calculation and analysis of the results efficient. However, if the A/B test is more complex or involves many groups, other distributions may be more appropriate. The selection of distribution should take into account the nature and complexity of the test to determine the appropriateness for the situation."
275,Granularity should be the number of users who click on the ad because it reflects real user behavior and attribution period should be about 1 day because it is not too little and not too much.
276,"A/B testing should not be done; a normal distribution or t-distribution should be used, which is used to test the mean of two experimental groups."
277,"It should be because moving the ad position is not a significant change or a new format and the results are seen in a short period of time, splitting users easily and appropriately, making A/B testing appropriate."
278,"It should be used because it is an alternative way to test whether changing the ad position will affect sales or not. It is just two choices, not A or B, which is the main characteristic of AB testing."
279,"Granularity should be session level to measure user interactions across visits, useful for understanding how changes in ad placement influence user actions across sessions. The length of the attribution period is the length of time a user is tracked, which can be anywhere from 1-4 weeks to allow for longer-term tracking to measure the impact of ad changes on user behavior over the long term."
280,"Agreed, because this A/B testing has binary results, and using a binomial distribution makes it easier to test hypotheses."
281,A/B testing should be used to clearly show the results of changing the ad position with the old one at the same time and reduce the risk of changing to the new system.
282,"I disagree because the variability of each person&#39;s chances is high and we want to measure whether the click-through rate is higher, so it is better to use the Bernoulli distribution."
283,"Because using A/B testing by placing the A test in the same position and the B test changing the position of the ad will allow you to compare which of the two tests, which pass the same randomness, can increase the number of clicks by users on the ad more."
284,"Granularity: Days because it is not too short and not too long. Normally, online video platforms usually summarize viewership and other figures on a daily basis. If it is hourly, there will be variables related to different times in daily life, making it uncertain. Attribution period: 7 days because normally, on online platforms, users tend to decide to click on ads in a short period of time anyway, so there is no need to use a long time for testing. It also prevents the results from being distorted by other factors."
285,"Since moving the Ads position may or may not increase sales, A/B testing is required, divided into a control group and a test group to see the difference in sales in both groups."
286,Granularity: The experiment should be conducted at the individual level to assess the impact of the change on individual user behavior. Attribution Period: It should be 1-2 weeks as this is an ideal time to collect data and analyze the impact of the change on user behavior.
287,"A/B testing should be used to reduce the effect of randomness during the experiment. Since randomness occurs on both A and B, this randomness is constant on both. The results of the experiment will be due to the difference between A and B only."
288,"I suggest Hamtaro should implement a 50/50 split. 50/50 split Pros: 1. Equal Exposure: A 50/50 split ensures that both versions (old and new ad positions) receive an equal amount of exposure. This can be advantageous for a balanced comparison and helps minimize biases introduced by uneven exposure. 2. Faster Learning: An 50/50 split allows for faster learning about the performance of the new ad positions. The majority of users experience the new positions, providing a quicker assessment of their effectiveness. Cons: 1. Potential User Impact: If the new ad positions have a negative impact on user experience, exposing 50% of users to them may lead to dissatisfaction and a higher risk of negative consequences. 80/20 split Pros: 1. Limited User Impact: If the new ad positions have a negative impact, limiting exposure to 20% of users minimizes the potential negative consequences compared to a 50/50 split. Cons: 1. Slower Learning: If the new ad positions are significantly better, a 50/50 split might result in slower learning and delayed implementation of improvements. 2. Risk of Biased Results: An 80/20 split may introduce bias if the 20% of users exposed to the new ad positions are not representative of the entire user base. This could lead to skewed results and inaccurate conclusions. 3. Missed Opportunities: If the new ad positions are indeed better, an 80/20 split may result in missed opportunities for increased revenue or engagement for the 80% of users not exposed to the improvements.
"
289,"For granularity, it should be the number of times the ads are shown to the user so that the test has sufficient granularity. As for attribution period, it should be only 1 day so that the click results that occur within a short period after the ads are shown can be measured so that the advertising performance can be evaluated accurately and immediately."
290,"Because A/B testing allows you to directly compare the results and user behavior of ad placement changes, with less risk than immediate ad placement changes."
291,"Granularity depends on the sample size, e.g. higher granularity may be required to look at small-scale effects, or the ability to store and process data, e.g. higher granularity may result in a larger volume of data. The attribution period depends on the time commitment of the marketing team and the amount of data needed to support the experiment."
292,"Should have high granularity, should be the number of clicks on the ad because it is a detailed behavior, suitable for observing whether the ad position has an effect on increasing the number of views of the ad or not. Should have a short attribution period because it is necessary to know the response from the user immediately when seeing the ad at that position."
293,"Agree because the ad selection can only be 1 (click) or 0 (no click), so use binomial distribution."
294,"The advantage of the 50/50 model is that it can collect data in full quantity for testing quickly. The disadvantage is that there is a high risk that the new position (B) will be a bad position and will cause the loss of ad clicks that should have been received from the original. The disadvantage of the 80/20 model is that it takes a long time to collect complete data, but the advantage is that there is low risk because we will show type B to a small proportion of users. Therefore, if the display of type B is not good, it will not have much effect. The 80/20 model is chosen because the attribution period is quite short. Therefore, collecting complete data from this selection does not take too long and there is less risk."
295,"The 50/50 split will give faster results than the 80/20 split. The 80/20 split increases the risk of the experiment. I think the 50/50 split can be used because the placement of the ads is unlikely to cause problems for the system, allowing for faster data collection from the experiment."
296,"Granularity in the context of setting the attribution period for A/B testing refers to the level of detail at which the data is analyzed. For Hamtube, this could mean looking at the timing of ad clicks in relation to the ad placement changes to understand which granular time frame provides the most insightful data."
297,I agree because it is a comparison between the old (old advertisement) and the new (new advertisement).
298,"Granularity should be at a level sufficient to provide effective information for decision making. For Hamtube, an online video viewing platform with a large number of users, it is important to split the experiment into large enough groups to see significant results. Meanwhile, the attribution period should be the most appropriate time to measure the advertising effect, which may depend on the nature of the video and the interest of the viewers, and their preferences. "
299,"50/50 Proportion Advantages 1. Due to the equal proportions, hypothesis testing and outcome testing is efficient. 2. Results can be directly compared between groups. Disadvantages 1. If the results are not very different, it may be difficult to tell which change caused the result. 80/20 Proportion Advantages 1. The proportion that made the change is greater, making the experimental results clearer. 2. If we assume that a change will affect the result, the experiment time can be reduced. Disadvantages 1. The proportions of the two groups are not balanced, which may make the experimental results less reliable. 2. Analysis of the experimental results may be more difficult due to unequal proportions of each group. In conclusion, the 50/50 proportion is more appropriate because it gives more reliable experimental results and is more convenient to apply."
300,"50/50 If the new position ad is worse than the old position ad, it will hurt the original business more than the 80/20 ratio, but 50/50 will work for Type B faster than 80/20."
301,50/50 will give you quick results but risk losing morale. 80/20 will take a long time and cause less viewers.
302,"Agree, because there are only two outcomes: click or not click on the ad, and one user&#39;s decision does not affect other users."
303,"A/B testing can help Hamtaro test whether moving ad placements can increase click-through rates, without having to make major changes, just on a few videos. It&#39;s a simple, one-size-fits-all test that eliminates the risk of big changes to the system. All it does is provide data to help make a decision about whether to change the entire system or not."
304,"Agree, because each user click on an ad is an independent event, binomial is suitable for data in the form of success/failure, where the click on an ad can be viewed as data in this manner."
305,"80/20 because if the placement of the ad in the new location is not good, using the 50/50 ratio will make people see it more and may cause the sales to decrease significantly. So if you want to not have much risk, you should use 80/20."
306,"Agree: Binomial distribution is an appropriate choice for measuring outcomes with two states such as “click” or “no click”. This experiment wants to know if changing ad position affects clicks, which is appropriate for situations where a binomial distribution is used."
307,"50/50 ratio: Advantages: It helps the test to be complete and get quality data. Disadvantages: The test may not get enough data for verification because the change has little impact. 80/20 ratio: Advantages: The test will have a greater impact on the group that sees the new position more, which will reduce the testing time. Disadvantages: The data will be unbalanced, making it difficult to analyze the results and making the test unreliable. I think the 80/20 ratio is more suitable for this problem because the higher the ratio, the clearer the consumer behavior will be, allowing Hamtaro to know the market demand faster. However, it depends on the attribution period. If the period is long, Hamtaro can use the 50/50 ratio, which will give better results."
308,Granularity is the ID of the viewer of the video to track how many times the user has watched the video and clicked on the ad. The attribution period should be 7 days to get the real data about the click on the ad.
309,"A/B testing is a valuable tool for Hamtaro to experiment with changes in ad placement. It provides a systematic and controlled way to test hypotheses, ensuring that decisions are based on solid evidence. The insights gained from A/B testing can guide informed decisions about whether or not to implement the changes permanently across the platform."
310,"Agree because what hamtaro wants to test is a test between the original ad position (A) and the new ad position (B) to test whether moving the ad position actually helps increase sales or not. Therefore, doing A/B Testing by measuring sales from the original ad position and the new ad position by doing A/B Testing is appropriate."
311,Hamtaro should use A/B testing to test how to move the placement of his ads to increase sales because it compares the performance of two different variables: the current ad placement and the newly moved ad placement. Hamtaro can test these two ad placements with different audiences and see which placement results in more sales using A/B testing.
312,"Using a binary distribution in A/B testing makes sense if the outcome of the test is a binary outcome, meaning there are only two outcomes (e.g. click or no click), which is what happened in this ad test. If there are multiple outcome categories or other characteristics to analyze, a different statistical distribution may be needed."
313,"Reasons why Hamtaro should use A/B testing to test ad placement migration on Hamtube: Measure compelling business outcomes: A/B testing allows Hamtaro to accurately measure the effect of ad placement migration, whether it’s increased sales or clicks, which are crucial data for deciding on marketing changes. Improve ad performance: A/B testing helps marketing teams understand which placements generate more clicks from their ads, and can then help them optimize their ads for the most effective results. Reduce risk: A/B testing reduces the risk of making changes without any underlying data or evidence, allowing marketing teams to act on the insights gained from testing. Audience optimization: A/B testing helps Hamtube determine which ad placements are most suitable for their target audience, which can help tailor marketing strategies to user needs."
314,A/B testing should be used because considering the repositioning of ads and increasing sales (more users clicking on ads) involves randomness.
315,"Agreed, because Hamtaro wants to test whether moving the ad position (A) and the new ad position (B) will increase sales or not. Therefore, it makes sense to measure the increase in sales by measuring the clicks on the ad at the old and new positions using A/B testing."
316,"Hamtaro should use A/B testing to test which ad placement will increase sales more. Using A/B testing will help to find the conclusion, allowing to test the effect of changing ad placement on different target groups and reduce the risk that may occur from changing ad placement immediately."
317,"Agree because using binomial distribution is suitable for this case because there are only two possible outcomes: the user clicks on the ad and does not click on the ad, many times combined."
318,"50/50 is more risky for the user but will give faster results, while 80/20 is less risky (if the user does not like it) but will give slower results. It is recommended to choose 80/20 because it is more practical and much less risky."
319,"Select Hit rate, the ratio of ad clicks / number of times the ad is shown, because we believe that we will actually count whether the user clicks each time the ad is shown."
320,"number of users that click/number of users viewing ads on Hamtube attribution period : 3 days because it is a suitable period of time to know which position the user clicked. If it is longer than this, it may be uncertain which advertisement is influential."
321,"Agree because we fix the number of ads shown to users, such as Type A shows how many people, Type B shows how many people, and want to find the click rate of each type, so we should use binomial. "
322,"Granularity should be weekly, attribution period should be 7 days as it is suitable for advertising on Hamtube where buyers make quick decisions."
323,"Granularity: It is best to use a &quot;user-level&quot; granularity. This allows for detailed measurement and analysis of individual user behavior in response to ad placement changes. This level of analysis improves our understanding of how individual users respond to ads, which is important for assessing the impact of ad placement changes on clicks. Attribution Period: Choose a long attribution period of 30 days after an ad click because: A long attribution period allows us to capture more of the actions of users who click on an ad. This allows us to see the impact of an ad over a longer period of time and capture a more comprehensive view of user actions without missing important information that occurs shortly after an ad click."
324,"It should be used because it shows the results before making changes, thus reducing the risk."
325,"Granularity is the number of users who click on the ad. The duration of the attribution period should be 2-3 days because it depends on the user&#39;s behavior. If it is too short, it may receive too little data that is difficult to measure. If it is longer, it may cause users to click repeatedly."
326,Granularity: user-level - because the goal is to measure user reaction to changes in ad placement. Attribution Period: An ideal period might be between 1-2 weeks - because users may respond to an ad after viewing it several times or may take some time to decide to click on it.
327,50/50 is riskier but will give you faster decision-making results. 80/20 is slower but not as risky. 80/20 is more appropriate since advertising revenue is likely to be the platform&#39;s main source of income. It is not worth the risk.
328,Granularity is the number of times that people watch this video. It is not necessary to separate it by user ID because each time the user views the ad or not. Use the metric as the number of times the ad is clicked/the number of times that people watch the video. The attribution period should be 12 hours because people are unlikely to sit and watch the clip for more than 12 hours (take a break to eat. Watching continuously for a long time is not good for your health????)
329,"The granularity should be to collect data on every click on the ad on a daily basis to get a more detailed picture of Hamtube&#39;s user usage. The attribution period should be around 7 days to get reasonable or reliable data.
"
330,Agreed because the binomial distribution is suitable for two-group A/B experiments.
331,"Opting for user-level granularity in analysis and a 30-day attribution period provides a detailed and comprehensive understanding of how individual users respond to changes in ad placement. This approach allows Hamtaro to assess both short-term and long-term effects, leading to more informed decisions regarding the optimization of ad positions on the Hamtube platform."
332,"Granularity can be either User-level or Session-level, depending on budget and speed required. - User-level is more detailed, can track results in the long term, can do user segmentation by dividing characteristics such as website visit frequency, personal preferences, personal information (for example, in Facebook targeted ads, it will say Why am I seeing this ads? If you click to see, you will find that there are many factors such as you liked that page, you are this age, you are this gender). - Session-level, although cannot track or create personas, has faster speed and the data can be analyzed more easily. For Attribution Period, choose a week level because if it is too short, it may not be effective. If it is longer than this, the decision to see the ads may be due to other factors."
333,"Granularity is hits, which is the number of times the video is watched. Let the metrics be the number of clicks on the ad in the video / the number of times people watch the video. The reason is that we want to measure whether the change in ad placement causes more clicks or not, so we should measure it per video view, for example, whether the user clicks after watching or not. The attribution period is 1 hour, because we want to know whether seeing the ad in the video causes people to click right away, assuming that most videos are not longer than 1 hour."
334,I agree because it creates distribution and the choice of ad clicks is just 0 and 1: click or no click.
335,"50/50 split: Advantages: A 50/50 split allows for a large and systematic experiment, where all groups are tested equally. This reduces the potential for statistical error in the event of unequal distribution. Disadvantages: A 50/50 split can lengthen the time it takes to collect data and analyze it, as it requires waiting for enough data to make the results more reliable. 80/20 split: Advantages: An 80/20 split allows for more variation in the experiment group, which can help reflect better results more quickly. Disadvantages: An 80/20 split can lead to experiments that are not unequal in the experiments, which can make the results less reliable. A more suitable model is the 50/50 split, because what we want to achieve is equality, meaning we really want to know which one is better. We don’t want to rush anything, which means that the experiment may not need to be repeated because it is an unequal experiment. Another reason is that if a lot of users use hamtube, it means that we will have a lot of data to collect, so there is no need to rush."
336,"A/B testing should be used because A/B testing is a test that can compare 1 variable, in this case, the ad position, very well because the testers are divided into 2 groups, A and B, and each group will encounter different independent variables but otherwise the same, so if the results are different, the difference in results must be due to the independent variable."
337,"Hamtaro should use A/B testing to test changes in ad placements because A/B testing is a scientific way to test the effectiveness of changes by comparing two types of changes. Hamtaro can set the variable in the experiment to be the ad placement, divided into two versions as follows: Version A: Display ads at the original location; Version B: Display ads at a new location. Then, Hamtaro sets the target audience and advertising budget to be the same for both versions and starts experimenting for 1 month."
338,Agreed because the two situations are differentiated by only one variable: ad placement.
339,"The 50/50 model is riskier than the 80/20 model because the new model may cause a large loss of profit. However, the 80/20 model is slower than the 50/50 model because the sample size allocated to the new model is small. You should choose the 80/20 model to reduce the risk of losing profit from the new system."
340,"Choosing a binomial distribution for A/B testing is a good decision. Binomial distributions are used with variables that have only two outcomes (i.e. clicks or no clicks). In this case, it makes sense to use it to measure the number of times users click on ads in each group (control and experimental groups)."
