ID,answer
0,"The granularity should be low because we want to know whether users overall will click more on the ad, not how individual users will click on it. The attribution period should be long (around 30 days) because there might be cases where users are not familiar with the new location and click on it by mistake at first, which might make the data inaccurate.
"
1,"Agree because it is collecting data from multiple users and is checked by clicking ads, so there are only two possible cases: click or not click."
2,"Granularity should be #checkout events/ #cookies because we want to see how many times a person clicks, cookies will get the same person, and it works for a non login attribution period of about 2 days because not all products are of interest to us, so we need to allow time for the user to find products they like."
3,"Agree. Let X~Binomial(N,p), where p is the ratio of the user clicking ad, be able to test whether p_treatment &gt; p_control or not."
4,"Agreed, because A/B Testing is an effective way to measure the effect of interesting changes between two options (A and B) without affecting other variables, which is similar to Hamtaro&#39;s case of testing an ad placement move. Using A/B Testing, we can clearly and immediately measure whether changing ad placements has an effect on sales."
5,Hamtaro should use A/B testing for testing because A/B testing allows us to see the difference in sales between moving and not moving the ad at the same time.
6,The click-through period and total views are set to 1 day because it shows how many viewers clicked on the ad compared to the total viewers.
7,"Granularity in A/B testing on Hamtube ad placement migration refers to the choice of measuring values such as clicks at the top. Attribution period is the time period set to track user activity after seeing an ad. The length of the attribution period should be set appropriately to the nature of your business and product, such as 7 days or 30 days, to obtain complete data and effectively compare results."
8,"Because A/B testing is about comparing the results of changing just one thing, in this case, the ad position, A/B testing is the right way to experiment."
9,"The 50/50 model can collect samples quickly, but the problems that may occur from the new experimental model will affect half of the users. The 80/20 model will affect a small number of users, not much impact on the platform, making it safer. But it also slows down the sample collection. For hamtube, I think the change in the placement of the ad will not affect the users who watch the video that much. But if hamtube has a revenue sharing with the users who upload the video, this experiment may affect them. If there is no sharing, I think doing a 50/50 sharing to collect samples quickly so that the business can make more profit. It will be a good choice for investors who want to see the business grow quickly. If there is, I think doing the 50/50 again because if the sample collection is fast, the decision can be made quickly as well."
10,"50/50 Advantages: Get information quickly. Disadvantages: High risk because if users do not like the new system (ads that move positions), it may affect the business. 80/20 Advantages: Lower risk because there are few users who will be affected if it is not good. Disadvantages: It will take a long time to collect information. Choose 80/20 because Hamtube is the number 1 famous platform in the universe, so a bad user experience can have a huge impact on Hamtube&#39;s business."
11,"A/B testing is useful for Hamtaro to test ad placements for the following main reasons: Data-driven decision making: It allows Hamtaro to make decisions based on real data from the results of the experiment, not just guesswork. Reduce risk: If a new ad placement doesn&#39;t work, it can revert to the old one. Understand users: It helps to understand user behavior and preferences better. Improve user experience: It can help users have a better experience with the platform."
12,"The 50/50 ratio is very risky because 50% of users will see the new format ads. If the new format is not good, users may not like it and stop using Hamtube. And with a ratio of 50%, it is very risky. But with a high ratio, we can quickly know which is better, the new or the old one. While the 80/20 ratio is low risk because if the new format is not good, we will lose only 20% of users. But because the ratio is low, we cannot quickly measure which is better. We may have to experiment again by increasing the ratio for the new format to be more certain. Think of Hamtube as a big platform and the purpose of using the app is not to watch ads. Therefore, there is no need to rush to collect data and no need to rush to take a big risk. Therefore, we should use the 80/20 ratio."
13,Hamtaro should use A/B testing because A/B testing can accurately measure the effect of ad placement shifts (if the split ratio is appropriate) by dividing the sample into two groups and testing.
14,"Agree, because this experiment is a Bernoulli distribution (there are only clicks on ads and no clicks), where each Bernoulli belongs to a specific user, and when combined, each user is independent, making it a Binomial distribution."
15,Agree because the position of the ad affects the chance of the ad being clicked. 
16,"Granularity should be the number of ad clicks per ad impression, because if the repositioning really works better, the ratio of granularity should also increase (more people click). Attribution period should be short, such as 30 seconds, based on the ad duration of around 30 seconds to see that if users really like to watch the ad, they should click from the moment they see it. Therefore, the attribution period should not be long."
17,"It should be because A/B testing allows Hamtaro to test the effect of a single change (in this case, the ad position) by comparing it to a control group that makes no changes (but you have to choose the right metric to measure, such as using click-through rate as the metric according to the problem)."
18,"50/50 may give faster results but there is a risk that most viewers will dislike the new format and it will affect the overall ad. Therefore, 80/20 is recommended because it is less risky and analysis has shown that 80/20 gives better results."
19,Agree because the possibility of clicking on an ad is just a click or a non-click.
20,"50/50: Collect data faster, but with higher risk because if the new layout is much worse, there will be more effective users and it will affect the ad revenue. 80/20: Collect data slower because the new layout that is only seen by 20% will require a lot of people to reach the target, but with lower risk because we can stop the experiment if we see any problems, be it bugs or the layout itself is not good. 80/20 is more suitable because it affects important stakeholders such as the people who buy ads directly. If there is a mistake, it will reduce the credibility of our product with the people who buy ads, causing people to buy less."
21,"Granularity -&gt; If Hamtaro wants to examine how moving an ad&#39;s location affects clicks from users in different areas of the site. So, a high granularity (e.g. by site area) might be a good choice, as it gives Hamtaro a detailed understanding of the impact of moving an ad&#39;s location across all areas. However, if Hamtaro chooses too high a granularity, he might miss out on important information that could influence his decision. Attribution Period -&gt; A short period of time (e.g. 7 days), as Hamtaro wants to know how users react immediately after seeing an ad in a new location."
22,Agree. The reasons are: 1. Easy to understand. 2. The result (click or not click) is binary. 3. Efficiency and speed of calculation due to the large data size.
23,"The number of times users see the ad because we will test how many clicked the ad from all users who saw it. The attribution period should be about 1 week because if it is too long, the number of clicks may decrease. However, if it is too short, the data may not be reliable."
24,"Granularity should be the number of users who click on ads and have an attribution period of 1 day. The granularity is chosen as the number of users because it is a measure that matches the objective of increasing sales and can be easily done in practice, such as installing Google Analytics. The period is 1 day because if the time is too short, you may get biased data such as branding or if it is too long, it may be caused by users clicking randomly without intending to."
25,"50/50 Quick conclusion in exchange for high risk that if B is worse than A, it will result in a disadvantage from the fact that A is already good. 80/20 Slow conclusion in exchange for low risk that if B is worse than A, it will result in a disadvantage from the fact that A is already good. 50/50 Hamtaro wants fast results and is willing to accept the risk."
26,"50/50 ratio: It helps to see the results quickly whether they are good or bad, but it has a higher risk than 80/20 that if you change it, the results will not be good, it may result in lower sales. 80/20 ratio: It has a relatively low risk because it is rare to see a new change. If we know that it is not good, it can be easily fixed. But the disadvantage is that it takes a long time to see the results of the new ad position. For the problem that is being found, the 80/20 ratio test may be a better choice because it will help to see the trend of change faster, while still maintaining careful work. But finally, the observation that requires time effectively must be analyzed to be reliable and fair in order to know whether the new version is really good.
"
27,"Hamtaro should use A/B testing because it allows Hamtaro to experiment with changes without having a significant impact on Hamtube users immediately if they don&#39;t get the results they expected after they&#39;re done, and it also helps to clearly see if the changes have an effect on more clicks on your ads."
28,"50/50 is faster but riskier as the new placement may have a negative impact on customers and also has the advantage of easy comparison since the number of users who saw the old placement and the number of users who saw the new placement are equal, so the data is available quickly. 80/20 is slower but riskier and does not impact the user experience as much. The 80/20 model seems to be more suitable for this problem because it is lower risk even though it is slower."
29,"Agree, because I want to know if moving the ad position to increase sales is effective compared to the original position and for such cases, using a/b testing will make it easier to draw conclusions."
30,"Disagree: Due to the limitations of binomial distribution, if an experiment needs to analyze results from complex data (e.g. time spent on the platform or user engagement patterns), binomial distribution may not be sufficient to capture such complex data. "
31,A/B testing will help us tell whether the &quot;new&quot; or &quot;old&quot; product that Hamtaro will place the ad on will increase sales more. Because A/B testing is a statistical hypothesis testing to tell according to statistics whether the new product is better or not.
32,"50-50 model Advantages - Easy analysis since sample size is same, less bias - If load balancing is used, 50-50 will not be as heavy as weighted model. Disadvantages - If ads don&#39;t work, that means 50% of people will experience the change, which may lead to negative effects such as more word of mouth. - Resource management requires more resources to migrate. 80-20 model is like reversing 50-50. Advantages - Less negative effects since only 20% of people will experience the change. - Easier mitigation, more economical. Disadvantages - Less statistical power - Bias because fewer people will not be representative. If Hamtube has a lot of traffic, is a reputation-sensitive site, and has enough capital and resources, I would choose 50-50. Otherwise just pick 80-20 as it is safer. "
33,"Yes, A/B testing is an effective way to evaluate the results of changes between two options (A and B) without external variables influencing the outcome. In the context of a retailer testing the relocation of an advertisement, employing A/B testing enables a clear and immediate assessment of whether this change impacts sales or not."
34,"Agree because - The data is binary (pressed/unpressed) which is consistent with the use of binomial dist - Binomial dist can be calculated quickly, making it easy to understand the results - Binomail allows the calculation of confidence intervals"
35,"The 50/50 option is to choose a higher proportion of ads in the new location, which will result in a much shorter testing period since the results will be faster because there will be more ads in the new location. However, the main disadvantage is that it is more risky because if the ad placement change is not effective, it will lose a lot of sales from the test. On the 80/2 side, the test will be slower because there is a smaller proportion of ads in the new location, but it is also less risky because there is a higher proportion of ads in the original location that have known sales. In Hamtube&#39;s A/B testing problem, the 80/20 option is more appropriate because ads are a source of high revenue for the platform. Moving the ad placement may result in an increase in disliked users, which can significantly reduce sales."
36,"Granularity = The number of times a user clicks on an ad, to measure whether users click on an ad more if the position changes. Attribution period = 1 week. Consider an attribution period that is not too long to allow for quick response and adjustment when results are seen.
"
37,I agree with Hamtaro because Binomial Distribution is suitable for A/B testing with two possible outcomes (e.g. click or no click) and helps in calculating the probability of the outcome.
38,"Advantages - It allows for a precise comparison of the results of both versions because the number of viewers who saw each version is the same. It reduces bias in the experiment because all viewers had the same chance to see both versions. - It takes less time to experiment than the 50/50 ratio because it allows for a sufficient number of samples to compare the results faster. Disadvantages - It may take a long time to experiment because it takes longer to get a sufficient number of samples to compare the results. Advantages and disadvantages of choosing the 80/20 ratio - It may result in inaccurate results because the number of viewers who saw each version is not the same, which may cause the results of the two versions to differ by chance. Conclusion - From the advantages and disadvantages of both ratios, it can be seen that the 50/50 ratio gives more accurate results but takes longer to experiment. The 80/20 ratio takes less time to experiment but may result in inaccurate results. - If Hamtaro wants the most accurate results, choosing the 50/50 ratio would be a better choice. However, if Hamtaro wants to save time in the experiment, choosing the 80/20 ratio would be a better choice. - In the case of Hamtaro who wants to test changes in the placement of ads, which may affect viewer behavior in the long term, I recommend choosing the 50/50 ratio to make the experiment results as accurate and comprehensive as possible."
39,"A/B testing should be used in testing because we want to test between the original ad position and the new ad position to see if the ad position actually affects sales, so it is appropriate to use A/B testing."
40,"Depending on the size of the channel, the risk that Hamtaro is willing to take "
41,"50/50 has the advantage of speed since both groups are the same size, so data can be collected from both groups quickly. However, the disadvantage is that half of the users will see the changes. If the changes cause any problems, it will increase the risk to the platform. 80/20 has the advantage of only 20% of the users will see the changes, so it can reduce the risk of any problems from the changes. However, the disadvantage is that it takes longer than 50/50 because the number of users who see the changes is much different from the number of users who use the old model. Therefore, it will take more time to collect enough data from the users. For this problem, 80/20 is more appropriate because the problem is not urgent and is related to sales, so it should not cause more risk than necessary."
42,"50/50 will allow for a full sample collection faster, but also carries a higher risk of losing clicks from Group B, compared to 20/80, which is less risky but takes longer to collect. Since clicks may affect the advertising revenue on hamtube, and there is no rush to reach a verdict, the 80/20 split is more appropriate."
43,"Agreed, because A/B testing is often used to test things, requiring an initial reference and a new interface change, by testing it on real user experiences to test those hypotheses, which is in line with the need to test new ad placements, while still having the old one and not exceeding the limitations of using A/B testing."
44,I agree that A/B Testing should be used because it is better to test whether the ad will stay in the same place or move.
45, Agree because clicking or not clicking on an ad can be a success or failure (0/1)
46,"It is not suitable because if we want to measure other outcomes that are not clicks, such as time spent on the platform, share clicks, etc., the binomial distribution will not meet the requirements."
47,"The advantage of 50/50 is that Hamtaro will have an equal number of users testing both cases, making the results closer to the truth than 80/20. But the disadvantage is that Hamtaro will have a higher risk in testing if the new ad placement is not successful. Here, we will choose to use the 50/50 ratio because we see that each user has variables that will suppress the ad placement in the new position that are very different. Therefore, we should use more samples in the experiment to get a close value because advertising is an important part that should be studied clearly for long-term use."
48,Bernoulli changed the number of times people clicked on an ad in a sample group.
49," The 50/50 split takes less time to experiment than the 80/20 split because it has a larger sample size of users who experience the ad repositioning. However, the 50/50 split is riskier than the 80/20 split because there is a chance that users will dislike Hamtube&#39;s change and it will have a negative impact on the product&#39;s image. The 50/50 split is better because it takes less time to decide whether the ad repositioning will increase the number of clicks on the ad. As for the risk of users disliking the change, the ad repositioning should not have a negative impact on users enough to damage Hamtube&#39;s image.
"
50,"50/50 Advantages: - Balance: Equal grouping of users results in balanced and easily comparable data. - Speed: Data is obtained quickly and sufficient for analysis and decision-making. Disadvantages: - Impact: If the change is negative, it will affect a large number of people. 80/20 Advantages: - Low risk: If the change is negative, it will affect a small number of people. - Easy to test: New ideas or innovations can be easily tested without affecting a large number of people. Disadvantages: - Slow: It takes a long time to collect data to obtain significant data. - Insufficient data: Due to the small number of subjects, time is limited, so the data collected will be too little. Conclusion: 80/20 because it can reduce the negative risk that may affect a large number of people, but it is necessary to have enough time to collect data."
51,"Agree because we can see whether users click or not on the ad, which is consistent with the binomial distribution. By choosing the binomial distribution, we can calculate various statistical values from the data."
52,"Hamtaro should use A/B testing because it will allow him to see whether moving the ad position affects sales or not, regardless of other confounders."
53,"50/50 Ratio: Advantages: It is a dedicated test because both groups are given equal exposure to both ad placements: The 50/50 ratio allows both the control variable (old placement) and the experimental variable (new placement) to be tested equally. This can help Hamtaro get equal data to analyze the results. Disadvantages: It does not check whether the change has a significant effect: Choosing a 50/50 ratio may not be able to check whether the ad placement change has a significant effect because both groups are tested equally. 80/20 Ratio: Advantages: More weight given to the experimental group: In this case, 80% of the users will see the ad at the new location, which can help Hamtaro collect more significant data than the remaining group. Disadvantages: It is not tested equally: Giving more weight to the experimental group (80%) can cause the results to be influenced more by this group, which may result in inequitable results for the control group. Appropriateness: Which ratio is appropriate to choose depends on the objectives and questions that Hamtaro wants to answer. If the goal is to test whether the ad placement change has a significant effect, choosing a 50/50 ratio is a good choice. But if Hamtaro wants to collect more significant data from the experimental group, the 80/20 ratio might be a good choice, to give more weight to the experimental group of interest."
54,"50/50 will allow us to compare the results of clicking on the ad of the old and new positions equally, but 50/50 will prevent us from examining the effects of other uncontrollable variables, such as the personal preferences of the testers. 80/20 will allow the results of changing the button position to be based on the preferences of the majority of people, making the results of this change more reliable than the 50/50 method. However, 80/20 will make the comparison of the results of the change and non-change groups more complicated because the sample groups are not equal. I think Hamtaro should choose the 80/20 method to get the most likely data from the sample group, but it may need to collect more data for analysis to be highly reliable."
55,"80/20 because it is safer in case the new ads do not work and affect the usage and his boss does not rush to submit the conclusion soon, so it can be done gradually."
56,I agree with using Binomial Distribution because clicking on an ad has two outcomes (click or not click) which makes it suitable to use Binomial distribution and Binomial distribution makes it easy to calculate probability and compare outcomes between two groups.
57,"Choosing a 50/50 split cause &quot;Investing involves risks, so let&#39;s embrace it&quot;. It&#39;s a faster approach, though less secure. On the other hand, an 80/20 split is play safe way, prioritizing security over speed."
58,"Agree because the result of one experiment, what we are interested in is click or not click."
59,"A/B testing is essential for Hamtaro’s marketing team on the Hamtube platform to compare the results of moving ads to a new location with the original location. This method provides reliable data by randomly assigning users to a control group and an experimental group, giving a clear picture of the effectiveness of the change. A/B testing reduces business risk by testing the results before implementing the change on every user, reducing uncertainty and helping to adjust both immediate and long-term marketing plans based on the data, thus adapting and improving Hamtaro’s marketing plans on the platform."
60,"Granularity should be ads clicked/ unique user because ads clicked/ unique user shows how much the average user clicks on ads. Attribution period should be 1 day per session because when watching a video, users are more interested in videos than ads (no one wants to watch ads). So I assume that no new user will remember the ads from the previous day."
61,"Agree with Hamtaro that he chose to use binomial distribution to replace the distribution of A/B testing this time because binomial distribution follows the assumptions of A/B testing as follows: - There are a fixed number of experiments. - Each experiment is independent of each other. - The results of each experiment are independent of each other. - The results of the experiment are only 2 outcomes: success or failure. In Hamtaro&#39;s case, there are a fixed number of experiments, which is 1 month. Each experiment that the viewer sees the ad is independent of each other. And the result of each experiment is whether the viewer clicks the ad or not. Therefore, binomial distribution is suitable to replace the distribution of A/B testing this time."
62,"Agreed, because we can model our experiment as the likelihood of clicking ads, which is a discrete event with only two outcomes: click or not, and we collect data multiple times, which fits the definition of a binomial distribution."
63,"I agree with Hamtaro because if we look at the chance of users clicking on an ad as a success chance and doing it many times, it will be like a binary distribution."
64,"Agree because the number of times or click rate is always an integer, so a binomial distribution can be used to show the distribution of data."
65,"The 50/50 ratio can provide faster data flow compared to the 80/20 ratio, but it is more prone to misleading conclusions (current trends, seasonality, major events). Therefore, the 80/20 ratio is preferred because we want to know whether users click on more ads in the long run (no misleading conclusions)."
66,"Granularity cookies per 1 day attribution period should be 1 day, which is an appropriate period of time for user browsing and purchasing. It should not be too short or too long (depending on the type of product being advertised). If it is too short, users will have already viewed the product and not choose to view it, but it will still be counted."
